[
  {
    "id": "easy-run",
    "canonical_name": "Easy Aerobic Run",
    "family": "easy",
    "status": "draft",
    "target_adaptation": [
      "plasma-volume",
      "capillarization",
      "mitochondrial-density",
      "stroke-volume",
      "musculoskeletal-durability"
    ],
    "venue": ["any"],
    "placement": ["base", "build", "peak", "taper", "offseason"],
    "attribution": null,
    "provenance": "uncitable",
    "structure": {
      "segments": [
        {
          "kind": "work",
          "duration": {
            "min": 1800,
            "max": 4800,
            "unit": "s"
          },
          "intensity_ref": "self"
        }
      ]
    },
    "intensity": {
      "primary_anchor": "rpe_10",
      "anchors": [
        {
          "model": "rpe_10",
          "range": [2, 4],
          "confidence": "exact",
          "note": "대화 가능해야 함. 이게 유일하게 신뢰할 만한 현장 기준."
        },
        {
          "model": "daniels-vdot",
          "zone": "E",
          "confidence": "exact"
        },
        {
          "model": "pct_hrmax",
          "range": [0.65, 0.78],
          "confidence": "approx",
          "note": "HRmax 추정식 자체가 SEE ±10bpm 이상이라 이 구간은 유도된 근사의 근사."
        },
        {
          "model": "pct_vo2max",
          "range": [0.59, 0.74],
          "confidence": "rough"
        }
      ]
    },
    "claim": {
      "proposition": "낮은 강도의 누적 시간이 혈장량·모세혈관·미토콘드리아 적응을 만든다. 강도가 아니라 시간이 변수다.",
      "mechanism": "낮은 강도로 오래 달리면 혈장량이 팽창하고(수일~수주), 모세혈관 밀도와 미토콘드리아가 늘어난다. 심박출량 증가는 주로 이완기 충만량 증가에서 온다. 대부분의 유산소 적응은 강도가 아니라 누적 시간의 함수다.",
      "evidence": {
        "tier": "plausible",
        "cite": [
          "Convertino VA (1991). Blood volume: its adaptation to endurance training. Med Sci Sports Exerc 23(12).",
          "Holloszy JO, Coyle EF (1984). Adaptations of skeletal muscle to endurance exercise. J Appl Physiol 56(4)."
        ]
      }
    },
    "test": {
      "detectable": true,
      "what": "같은 페이스에서 평균 심박수가 5~10bpm 떨어진다. 런린이가 가장 빨리, 가장 확실하게 체감하는 변화.",
      "when_weeks": {
        "min": 2,
        "max": 4
      },
      "mechanism": "주로 혈장량 팽창. 심장이 좋아진 게 아니라 혈액이 늘어난 것.",
      "evidence": {
        "tier": "tradition"
      },
      "confounds": [
        {
          "factor": "heat-acclimation",
          "severity": "high",
          "shares_mechanism": true,
          "note": "열순응의 주 기전도 혈장량 팽창이다. 봄에 시작해 여름에 HR이 떨어졌다면 훈련과 계절이 같은 기전을 같은 방향으로, 같은 타임스케일에 민 것이라 관찰만으로 분리 불가."
        },
        {
          "factor": "weight-loss",
          "severity": "moderate",
          "shares_mechanism": false,
          "note": "체중이 줄면 같은 페이스의 절대 부하가 줄어 HR이 떨어진다. 유산소 적응이 아니다."
        },
        {
          "factor": "sleep-caffeine-hydration",
          "severity": "moderate",
          "shares_mechanism": false,
          "note": "HR은 악명 높게 오염된 지표다. 단일 세션 비교는 무의미하고 4주 이동평균만 의미가 있다."
        }
      ],
      "if_absent": "4주 무변화는 실패가 아니다. 순서대로 의심할 것: (1) 이지런이 실제로 이지가 아니었음 — 가장 흔함 (2) 이미 적응된 상태라 헤드룸이 없음 (3) 측정 노이즈. HR 하락 없음이 적응 없음을 뜻하지는 않는다."
    },
    "safety": {
      "injury_risk": "low"
    },
    "common_errors": ["너무 빠르게 달림. 이지런의 실패 모드는 거의 항상 '이지가 아님'이다."],
    "instructions": "대화가 가능한 페이스로 30~80분 연속 주행. 페이스가 목표가 아니라 강도가 목표다. 언덕에서 느려지는 것이 정상이다."
  },
  {
    "id": "threshold-continuous",
    "canonical_name": "Continuous Threshold Run",
    "family": "threshold",
    "status": "draft",
    "target_adaptation": ["lactate-clearance", "mlss-shift"],
    "venue": ["road-flat", "track", "treadmill"],
    "placement": ["base", "build", "peak"],
    "attribution": "Jack Daniels",
    "provenance": "unrecorded",
    "structure": {
      "segments": [
        {
          "kind": "warmup",
          "duration": {
            "value": 900,
            "unit": "s"
          },
          "intensity_ref": "easy-run"
        },
        {
          "kind": "work",
          "duration": {
            "min": 1200,
            "max": 1800,
            "unit": "s"
          },
          "intensity_ref": "self"
        },
        {
          "kind": "cooldown",
          "duration": {
            "value": 600,
            "unit": "s"
          },
          "intensity_ref": "easy-run"
        }
      ]
    },
    "intensity": {
      "primary_anchor": "daniels-vdot",
      "anchors": [
        {
          "model": "daniels-vdot",
          "zone": "T",
          "confidence": "exact"
        },
        {
          "model": "race_pace_ref",
          "value": "60min race pace",
          "confidence": "exact",
          "note": "정의상 약 1시간 레이스 페이스. 초심자에겐 10k보다 훨씬 느리고, 엘리트에겐 하프에 가깝다."
        },
        {
          "model": "rpe_10",
          "range": [6, 7],
          "confidence": "approx"
        },
        {
          "model": "pct_hrmax",
          "range": [0.88, 0.92],
          "confidence": "approx"
        },
        {
          "model": "lactate_mmol",
          "value": 4,
          "confidence": "rough",
          "note": "4mmol/L은 MLSS의 관습적 대리값일 뿐 개인 편차가 크다. 2 vs 4 논쟁은 미해결."
        }
      ]
    },
    "claim": {
      "proposition": "젖산 정상상태 부근의 지속 주행이 그 정상상태 강도 자체를 위로 민다.",
      "mechanism": "젖산 생성과 제거가 균형을 이루는 최대 강도 부근에서 달려 그 균형점 자체를 위로 민다. 이 강도의 요점은 '힘들게 하는 것'이 아니라 정상상태를 유지하는 것이다. 넘어가면 다른 자극이 된다.",
      "evidence": {
        "tier": "plausible",
        "cite": [
          "Daniels J (2013). Daniels' Running Formula, 3rd ed. Human Kinetics.",
          "Faude O, Kindermann W, Meyer T (2009). Lactate threshold concepts: how valid are they? Sports Med 39(6)."
        ]
      }
    },
    "test": {
      "detectable": true,
      "what": "'comfortably hard'로 느껴지는 페이스가 이동한다. 같은 RPE에서 더 빨라짐. 이지런과 달리 느리고 노이즈가 크다.",
      "when_weeks": {
        "min": 4,
        "max": 8
      },
      "evidence": {
        "tier": "tradition"
      },
      "confounds": [
        {
          "factor": "concurrent-easy-volume",
          "severity": "high",
          "shares_mechanism": true,
          "note": "역치 세션을 하는 동안 이지런도 하고 있고, 이지런 역시 젖산 제거 능력을 개선한다. 같은 결과 지표를 같은 기전으로 민다. T 세션의 기여분은 관찰로 분리 불가."
        },
        {
          "factor": "pacing-skill",
          "severity": "moderate",
          "shares_mechanism": false,
          "note": "'comfortably hard가 빨라졌다'는 역치 이동이 아니라 강도 감각 보정 학습일 수 있다. 특히 처음 8주."
        },
        {
          "factor": "weather-surface",
          "severity": "low",
          "shares_mechanism": false,
          "note": "이슬점 상승은 같은 강도의 페이스를 느리게 만든다. 여름 역치 페이스는 겨울과 비교 불가."
        }
      ],
      "if_absent": "8주 무변화는 강도가 실제로 역치가 아니었을 가능성이 가장 크다. 대부분 너무 빠르게 달려서 T가 아닌 열화된 I 세션을 하고 있었다. 두 번째 의심은 이 신호가 원래 노이즈가 커서 8주로는 부족했을 가능성."
    },
    "prerequisites": {
      "min_weekly_volume_km": 30,
      "min_training_age_months": 6,
      "requires_workouts": ["easy-run"],
      "evidence": {
        "tier": "tradition"
      },
      "note": "구체적 문턱값은 관습이다. 근거 있는 컷오프가 아님."
    },
    "safety": {
      "injury_risk": "moderate"
    },
    "common_errors": ["너무 빠르게 달려 역치를 넘김. 그러면 T가 아니라 열화된 I 세션이 된다."],
    "instructions": "15분 이지 웜업 후 20~30분을 역치 강도로 연속 주행, 10분 쿨다운. 끝나고 10분 더 갈 수 있어야 정확한 강도다."
  },
  {
    "id": "marathon-pace-run",
    "canonical_name": "Marathon Pace Run",
    "family": "race-pace",
    "status": "draft",
    "target_adaptation": ["glycogen-storage", "fat-oxidation", "running-economy", "pacing-skill"],
    "venue": ["road-flat", "road-rolling"],
    "placement": ["build", "peak"],
    "attribution": "Kevin & Keith Hanson",
    "provenance": "unrecorded",
    "structure": {
      "segments": [
        {
          "kind": "warmup",
          "duration": {
            "value": 900,
            "unit": "s"
          },
          "intensity_ref": "easy-run"
        },
        {
          "kind": "work",
          "distance": {
            "min": 8000,
            "max": 16000,
            "unit": "m"
          },
          "intensity_ref": "self"
        },
        {
          "kind": "cooldown",
          "duration": {
            "value": 900,
            "unit": "s"
          },
          "intensity_ref": "easy-run"
        }
      ]
    },
    "intensity": {
      "primary_anchor": "race_pace_ref",
      "anchors": [
        {
          "model": "race_pace_ref",
          "value": "goal marathon pace",
          "confidence": "exact"
        },
        {
          "model": "daniels-vdot",
          "zone": "M",
          "confidence": "exact"
        },
        {
          "model": "rpe_10",
          "range": [4, 6],
          "confidence": "approx"
        },
        {
          "model": "pct_hrmax",
          "range": [0.8, 0.88],
          "confidence": "approx"
        }
      ]
    },
    "claim": {
      "proposition": "누적 피로 상태에서 목표 레이스 페이스로 달리면 레이스 후반부가 시뮬레이션된다.",
      "mechanism": "Hansons는 이걸 '누적 피로' 상태에서 수행해 레이스 후반 30~35km 지점을 시뮬레이션한다고 주장한다. 메커니즘 서사는 그럴듯하지만 이를 검증한 통제 연구는 사실상 없다. 실제로 작동한다면 페이싱 스킬과 연료 대사 쪽 기여일 가능성이 높다.",
      "evidence": {
        "tier": "tradition",
        "note": "인기 있는 방법론이지만 이 특정 주장은 tradition tier다. 유명함은 근거가 아니다."
      }
    },
    "test": {
      "detectable": false,
      "mechanism": "레이스 전에는 측정 불가. 목표 페이스 자체가 가설이라 순환 논증이 된다.",
      "evidence": {
        "tier": "tradition"
      }
    },
    "prerequisites": {
      "min_weekly_volume_km": 50,
      "requires_workouts": ["easy-run", "threshold-continuous"],
      "evidence": {
        "tier": "tradition"
      }
    },
    "safety": {
      "injury_risk": "moderate"
    },
    "common_errors": [
      "목표 페이스가 비현실적이면 이 세션 전체가 역치 세션이 된다. 그러면 이름만 M이고 실제로는 T다."
    ],
    "instructions": "웜업 후 8~16km를 목표 마라톤 페이스로 주행. Hansons 훈련법에서는 의도적으로 피로가 누적된 주중에 배치한다."
  },
  {
    "id": "vo2max-intervals",
    "canonical_name": "vVO2max Intervals",
    "family": "vo2max",
    "status": "draft",
    "target_adaptation": ["vo2max", "stroke-volume", "running-economy"],
    "venue": ["track", "road-flat", "treadmill"],
    "placement": ["build", "peak"],
    "attribution": "Véronique Billat",
    "provenance": "unrecorded",
    "structure": {
      "segments": [
        {